[
  {
    "id": "catalog_pool_leak",
    "title_zh": "商品目錄連線池漏水",
    "symptom_zh": "商品頁會越來越慢，大約兩分鐘後開始出錯；購物車與付款不受影響",
    "story_zh": "catalog v2 上線，新程式碼拿了資料庫連線不還",
    "difficulty": "medium",
    "on_stage": "primary",
    "lease_secs": 1200,
    "expect": {
      "detect_after_secs": [
        150,
        180
      ]
    },
    "mechanism_family": "db_pool_leak",
    "curve_preview": [
      [
        0,
        6
      ],
      [
        52,
        6
      ],
      [
        104,
        6
      ],
      [
        157,
        6
      ],
      [
        209,
        6
      ],
      [
        261,
        6
      ],
      [
        313,
        6
      ],
      [
        365,
        6
      ],
      [
        417,
        6
      ],
      [
        470,
        6
      ],
      [
        522,
        6
      ],
      [
        574,
        6
      ],
      [
        626,
        6
      ],
      [
        678,
        6
      ],
      [
        730,
        6
      ],
      [
        783,
        6
      ],
      [
        835,
        6
      ],
      [
        887,
        6
      ],
      [
        939,
        6
      ],
      [
        991,
        6
      ],
      [
        1043,
        6
      ],
      [
        1096,
        6
      ],
      [
        1148,
        6
      ],
      [
        1200,
        6
      ]
    ],
    "curve_unit": "connections/min",
    "curve_knob": "db.leak_per_minute"
  },
  {
    "id": "payment_provider_degradation",
    "title_zh": "付款供應商劣化",
    "symptom_zh": "付款偶爾失敗且逐漸變慢；其他服務不受影響",
    "story_zh": "primary 供應商逐步變慢，並開始回 502",
    "difficulty": "medium",
    "on_stage": "secondary",
    "lease_secs": 1200,
    "expect": {
      "detect_after_secs": [
        60,
        90
      ]
    },
    "mechanism_family": "provider_degradation",
    "curve_preview": [
      [
        0,
        0
      ],
      [
        7,
        0.005
      ],
      [
        13,
        0.009
      ],
      [
        20,
        0.015
      ],
      [
        26,
        0.021
      ],
      [
        33,
        0.029
      ],
      [
        39,
        0.037
      ],
      [
        46,
        0.047
      ],
      [
        52,
        0.058
      ],
      [
        59,
        0.071
      ],
      [
        65,
        0.084
      ],
      [
        72,
        0.101
      ],
      [
        78,
        0.118
      ],
      [
        85,
        0.141
      ],
      [
        91,
        0.163
      ],
      [
        98,
        0.192
      ],
      [
        104,
        0.22
      ],
      [
        111,
        0.258
      ],
      [
        117,
        0.295
      ],
      [
        124,
        0.344
      ],
      [
        130,
        0.392
      ],
      [
        137,
        0.455
      ],
      [
        143,
        0.518
      ],
      [
        150,
        0.6
      ]
    ],
    "curve_unit": "ratio",
    "curve_knob": "provider.primary.error_rate"
  },
  {
    "id": "fulfillment_backlog",
    "title_zh": "出貨積壓",
    "symptom_zh": "所有 HTTP 都正常，但訂單完成變慢；部分顧客等待 30 秒後逾時",
    "story_zh": "fulfillment worker 處理時間逐步拉長，已付款訂單堆在佇列",
    "difficulty": "hard",
    "on_stage": "backup",
    "lease_secs": 1200,
    "expect": {
      "detect_after_secs": [
        90,
        120
      ]
    },
    "mechanism_family": "worker_slowdown",
    "curve_preview": [
      [
        0,
        200
      ],
      [
        8,
        232.638
      ],
      [
        16,
        270.601
      ],
      [
        23,
        308.868
      ],
      [
        31,
        359.272
      ],
      [
        39,
        417.901
      ],
      [
        47,
        486.097
      ],
      [
        55,
        565.422
      ],
      [
        63,
        657.692
      ],
      [
        70,
        750.699
      ],
      [
        78,
        873.204
      ],
      [
        86,
        1015.701
      ],
      [
        94,
        1181.451
      ],
      [
        102,
        1374.249
      ],
      [
        110,
        1598.509
      ],
      [
        117,
        1824.563
      ],
      [
        125,
        2122.309
      ],
      [
        133,
        2468.644
      ],
      [
        141,
        2871.497
      ],
      [
        149,
        3340.09
      ],
      [
        157,
        3885.152
      ],
      [
        164,
        4434.571
      ],
      [
        172,
        5158.238
      ],
      [
        180,
        6000
      ]
    ],
    "curve_unit": "ms",
    "curve_knob": "worker.process_ms"
  },
  {
    "id": "audit_debug_logging",
    "title_zh": "稽核磁碟填滿",
    "symptom_zh": "稽核寫入越來越慢，最後 shipping 回 503；結帳跟著失敗",
    "story_zh": "shipping 開啟 debug 稽核，64 MiB 磁碟快速耗盡",
    "difficulty": "hard",
    "on_stage": "off",
    "lease_secs": 1200,
    "expect": {
      "detect_after_secs": [
        120,
        180
      ]
    },
    "mechanism_family": "disk_full",
    "curve_preview": [
      [
        0,
        1
      ],
      [
        52,
        1
      ],
      [
        104,
        1
      ],
      [
        157,
        1
      ],
      [
        209,
        1
      ],
      [
        261,
        1
      ],
      [
        313,
        1
      ],
      [
        365,
        1
      ],
      [
        417,
        1
      ],
      [
        470,
        1
      ],
      [
        522,
        1
      ],
      [
        574,
        1
      ],
      [
        626,
        1
      ],
      [
        678,
        1
      ],
      [
        730,
        1
      ],
      [
        783,
        1
      ],
      [
        835,
        1
      ],
      [
        887,
        1
      ],
      [
        939,
        1
      ],
      [
        991,
        1
      ],
      [
        1043,
        1
      ],
      [
        1096,
        1
      ],
      [
        1148,
        1
      ],
      [
        1200,
        1
      ]
    ],
    "curve_unit": "level",
    "curve_knob": "audit.verbosity"
  },
  {
    "id": "checkout_decoy_combo",
    "title_zh": "結帳假線索組合",
    "symptom_zh": "商品頁會越來越慢並出錯；購物車偶爾報錯但重試後成功",
    "story_zh": "catalog 漏水同時混入 cart 3% 的可恢復錯誤",
    "difficulty": "hard",
    "on_stage": "off",
    "lease_secs": 1200,
    "expect": {
      "detect_after_secs": [
        150,
        180
      ]
    },
    "mechanism_family": "db_pool_leak",
    "curve_preview": [
      [
        0,
        6
      ],
      [
        52,
        6
      ],
      [
        104,
        6
      ],
      [
        157,
        6
      ],
      [
        209,
        6
      ],
      [
        261,
        6
      ],
      [
        313,
        6
      ],
      [
        365,
        6
      ],
      [
        417,
        6
      ],
      [
        470,
        6
      ],
      [
        522,
        6
      ],
      [
        574,
        6
      ],
      [
        626,
        6
      ],
      [
        678,
        6
      ],
      [
        730,
        6
      ],
      [
        783,
        6
      ],
      [
        835,
        6
      ],
      [
        887,
        6
      ],
      [
        939,
        6
      ],
      [
        991,
        6
      ],
      [
        1043,
        6
      ],
      [
        1096,
        6
      ],
      [
        1148,
        6
      ],
      [
        1200,
        6
      ]
    ],
    "curve_unit": "connections/min",
    "curve_knob": "db.leak_per_minute"
  }
]
